{
  "schema_version": 1,
  "freeze_id": "F-fixture",
  "created_at": "2026-10-25T00:00:00Z",
  "configs": [
    {
      "experiment_id": "E-final-example",
      "identity": {
        "scientific_sha256": "0000000000000000000000000000000000000000000000000000000000000000",
        "code_sha256": "0000000000000000000000000000000000000000000000000000000000000000",
        "data_sha256": "0000000000000000000000000000000000000000000000000000000000000000"
      }
    }
  ]
}
